{
  "messageId": "08a1f037-dc1d-49dd-b349-d78f9857c8a3",
  "channel": "broadcast",
  "threadId": "33627b88-c58c-4017-a483-119d2e45c712",
  "timestamp": "2026-10-15T17:39:18.965822625Z",
  "content": "[proxmox-pve] [ARTIFACT key=crew-homelab-pilot/homelab-pilot/33627b88-c58c-4017-a483-119d2e45c712/proxmox-pve/agree-b9af3035-e196-4635-834a-00bc5df9f3b0 bytes=8342 - the FULL data is in the file /arti",
  "metadata": {
    "standAsideCount": 0,
    "modelName": "qwen3:32b",
    "agreeCount": 1,
    "concernCount": 0,
    "userQuery": "Describe the proxmox nodes.",
    "failureCount": 0,
    "gpuLabel": "ollama-rig0"
  },
  "agentName": "homelab-coordinator",
  "messageType": "review_ready"
}
