{
  "messageId": "899ffc6b-c47b-4b20-bd03-7e1a218ce6fa",
  "channel": "broadcast",
  "threadId": "33627b88-c58c-4017-a483-119d2e45c712",
  "timestamp": "2026-10-15T17:39:18.454999400Z",
  "content": "[ARTIFACT key=crew-homelab-pilot/homelab-pilot/33627b88-c58c-4017-a483-119d2e45c712/proxmox-pve/agree-b9af3035-e196-4635-834a-00bc5df9f3b0 bytes=8342 - the FULL data is in the file /artifacts/crew-hom",
  "metadata": {
    "role": "tooler",
    "pickReason": "cold-feasible (footprint 10615 MiB + resident 0 MiB <= usable 21616 of 24563 total) | bootstrap (3 samples)",
    "inputTokens": 25472,
    "inferenceMs": 17580,
    "totalTokens": 26112,
    "inferenceStartMs": 1792085940872,
    "artifact": {
      "bucket": "kubemoot_discussion_artifacts",
      "key": "crew-homelab-pilot/homelab-pilot/33627b88-c58c-4017-a483-119d2e45c712/proxmox-pve/agree-b9af3035-e196-4635-834a-00bc5df9f3b0",
      "bytes": 8342,
      "agent": "proxmox-pve",
      "tool": "agree",
      "createdAt": "2026-10-15T17:39:18.454937369Z",
      "preview": "[proxmox-list-nodes]\n{\n  \"status\": \"online\",\n  \"id\": \"node/rig2\",\n  \"type\": \"node\""
    },
    "modelName": "qwen3:14b",
    "server": "ollama-rig1",
    "toolsUsed": [
      "proxmox-list-nodes",
      "proxmox-node-status",
      "proxmox-list-storage",
      "proxmox-list-bridges",
      "proxmox-list-tasks"
    ],
    "model": "qwen3:14b",
    "signal": "agree",
    "outputTokens": 640,
    "gpuLabel": "ollama-rig1"
  },
  "agentName": "proxmox-pve",
  "messageType": "agree"
}
