{
  "agentName": "homelab-coordinator",
  "messageId": "0e6f2bd2-3053-4c87-b1c8-0652bce96d03",
  "timestamp": "2026-10-15T17:43:27.909370096Z",
  "messageType": "synthesis",
  "content": "The Proxmox cluster consists of three online nodes: **rig0**, **rig1**, and **rig2**. Here's a detailed overview:\n\n---\n\n### **rig0**\n- **Status**: Online  \n- **CPU**: 9.76% usage (0.0976 of 32 cores) ",
  "channel": "proxmox",
  "threadId": "33627b88-c58c-4017-a483-119d2e45c712"
}
