{
  "messageId": "97cea61b-10a0-43f7-97bf-6021bb77ca93",
  "channel": "broadcast",
  "threadId": "33627b88-c58c-4017-a483-119d2e45c712",
  "timestamp": "2026-10-15T17:39:00.869118937Z",
  "content": "List Proxmox nodes with their status, including node names, online/offline status, storage usage, and network configuration. Use proxmox-list-nodes and proxmox-node-status to gather details about each",
  "metadata": {
    "technologies": [
      "proxmox"
    ],
    "modelName": "qwen3:32b",
    "layers": [],
    "inferenceMs": 12511,
    "gpuLabel": "ollama-rig0",
    "wisdom": "List Proxmox nodes with their status, including node names, online/offline status, storage usage, and network configuration. Use proxmox-list-nodes and proxmox-node-status to gather details about each"
  },
  "agentName": "homelab-coordinator",
  "messageType": "advisory"
}
